{
  "$schema": "https://json-schema.org/draft/2020-12/schema",
  "$id": "https://ferricov.local/schemas/installation-wave2-case-capture.json",
  "title": "Installation wave-2 Oracle case capture record",
  "type": "object",
  "additionalProperties": false,
  "required": [
    "schema_version",
    "case_id",
    "oracle_execution_status",
    "evidence_status",
    "execution_status",
    "product_compatibility_evidence",
    "identity",
    "invocation",
    "environment",
    "process",
    "artifacts",
    "file_tree_effects",
    "observation_sha256"
  ],
  "properties": {
    "schema_version": { "const": 1 },
    "case_id": {
      "type": "string",
      "pattern": "^INST-[A-Z0-9-]+(:[a-z0-9_]+)?$"
    },
    "oracle_execution_status": {
      "type": "string",
      "enum": ["captured", "not_captured"]
    },
    "evidence_status": { "const": "oracle_reference" },
    "execution_status": { "const": "planned" },
    "product_compatibility_evidence": { "const": false },
    "not_captured_reason": {
      "type": "string",
      "minLength": 1
    },
    "identity": {
      "type": "object",
      "additionalProperties": false,
      "required": [
        "oracle_image_id",
        "upstream_commit",
        "upstream_release",
        "executable_path",
        "executable_sha256",
        "capture_host_tool"
      ],
      "properties": {
        "oracle_image_id": {
          "type": "string",
          "pattern": "^sha256:[0-9a-f]{64}$"
        },
        "upstream_commit": {
          "type": "string",
          "pattern": "^[0-9a-f]{40}$"
        },
        "upstream_release": { "const": "v2.5" },
        "executable_path": { "type": "string", "minLength": 1 },
        "executable_sha256": {
          "type": "string",
          "pattern": "^[0-9a-f]{64}$"
        },
        "capture_host_tool": { "type": "string", "minLength": 1 }
      }
    },
    "invocation": {
      "type": "object",
      "additionalProperties": false,
      "required": [
        "argv",
        "working_directory",
        "fixture_setup",
        "timeout_seconds",
        "cleanup"
      ],
      "properties": {
        "argv": {
          "type": "array",
          "minItems": 1,
          "items": { "type": "string" }
        },
        "working_directory": { "type": "string", "minLength": 1 },
        "fixture_setup": {
          "type": "array",
          "items": { "type": "string", "minLength": 1 }
        },
        "timeout_seconds": {
          "type": "integer",
          "minimum": 1
        },
        "cleanup": {
          "type": "array",
          "items": { "type": "string", "minLength": 1 }
        }
      }
    },
    "environment": {
      "type": "object",
      "additionalProperties": false,
      "required": ["mode", "variables"],
      "properties": {
        "mode": {
          "type": "string",
          "enum": ["clean_explicit", "clean_empty", "clean_override"]
        },
        "variables": {
          "type": "object",
          "additionalProperties": { "type": "string" }
        }
      }
    },
    "process": {
      "type": "object",
      "additionalProperties": false,
      "required": [
        "exit_status",
        "signal",
        "timed_out",
        "child_processes_observed"
      ],
      "properties": {
        "exit_status": {
          "type": ["integer", "null"]
        },
        "signal": {
          "type": ["integer", "null"]
        },
        "timed_out": { "type": "boolean" },
        "child_processes_observed": {
          "type": "array",
          "items": {
            "type": "object",
            "additionalProperties": false,
            "required": ["command", "exit_status"],
            "properties": {
              "command": { "type": "string" },
              "exit_status": { "type": "integer" }
            }
          }
        }
      }
    },
    "artifacts": {
      "type": "object",
      "additionalProperties": false,
      "required": ["stdout_bin", "stderr_bin"],
      "properties": {
        "stdout_bin": { "$ref": "#/$defs/artifact" },
        "stderr_bin": { "$ref": "#/$defs/artifact" },
        "extra": {
          "type": "array",
          "items": { "$ref": "#/$defs/namedArtifact" }
        }
      }
    },
    "file_tree_effects": {
      "type": "object",
      "additionalProperties": false,
      "required": [
        "root",
        "file_count",
        "symlink_count",
        "directory_count",
        "paths_sha256"
      ],
      "properties": {
        "root": { "type": "string" },
        "file_count": { "type": "integer", "minimum": 0 },
        "symlink_count": { "type": "integer", "minimum": 0 },
        "directory_count": { "type": "integer", "minimum": 0 },
        "paths_sha256": {
          "type": "string",
          "pattern": "^[0-9a-f]{64}$"
        },
        "selected_paths": {
          "type": "array",
          "items": { "type": "string" }
        }
      }
    },
    "observation_sha256": {
      "type": "string",
      "pattern": "^[0-9a-f]{64}$"
    }
  },
  "allOf": [
    {
      "if": {
        "properties": {
          "oracle_execution_status": { "const": "captured" }
        }
      },
      "then": {
        "not": { "required": ["not_captured_reason"] }
      }
    },
    {
      "if": {
        "properties": {
          "oracle_execution_status": { "const": "not_captured" }
        }
      },
      "then": {
        "required": ["not_captured_reason"]
      }
    }
  ],
  "$defs": {
    "artifact": {
      "type": "object",
      "additionalProperties": false,
      "required": ["path", "sha256", "bytes"],
      "properties": {
        "path": { "type": "string", "minLength": 1 },
        "sha256": {
          "type": "string",
          "pattern": "^[0-9a-f]{64}$"
        },
        "bytes": { "type": "integer", "minimum": 0 }
      }
    },
    "namedArtifact": {
      "type": "object",
      "additionalProperties": false,
      "required": ["name", "path", "sha256", "bytes"],
      "properties": {
        "name": { "type": "string", "minLength": 1 },
        "path": { "type": "string", "minLength": 1 },
        "sha256": {
          "type": "string",
          "pattern": "^[0-9a-f]{64}$"
        },
        "bytes": { "type": "integer", "minimum": 0 }
      }
    }
  }
}
