{
  "artifacts": {
    "extra": [
      {
        "bytes": 2226,
        "name": "doc.log",
        "path": "compat/installation/wave2/cases/INST-STAGE-001/doc.log",
        "sha256": "6cdf2032487927db0e185a61ff11909412c8f37ed97cb01062b4f111e84b97ad"
      }
    ],
    "stderr_bin": {
      "bytes": 49,
      "path": "compat/installation/wave2/cases/INST-STAGE-001/stderr.bin",
      "sha256": "1c671c7e99ff530451311814bbfdab043a8e7bae8a97accf02ab194aa595a53c"
    },
    "stdout_bin": {
      "bytes": 4337,
      "path": "compat/installation/wave2/cases/INST-STAGE-001/stdout.bin",
      "sha256": "34c78bff707e0e956b39f2845519e78979b1c68bef4ad78c93884b91322b9e4e"
    }
  },
  "case_id": "INST-STAGE-001",
  "environment": {
    "mode": "clean_explicit",
    "variables": {
      "LCOV_BUILD_DATE": "2026-07-06",
      "LC_ALL": "C",
      "PYTHONHASHSEED": "0",
      "RELEASE": "beta",
      "SOURCE_DATE_EPOCH": "1783375223",
      "TZ": "UTC",
      "VERSION": "2.5"
    }
  },
  "evidence_status": "oracle_reference",
  "execution_status": "planned",
  "file_tree_effects": {
    "directory_count": 59,
    "file_count": 320,
    "paths_sha256": "44fe846b89505f29a85b75488583ea0b24a9c0c9cde0a5a9fcfdb7f1220f2d44",
    "root": "/tmp/destdir-stage",
    "selected_paths": [
      "/tmp/destdir-stage",
      "/tmp/destdir-stage/usr",
      "/tmp/destdir-stage/usr/local",
      "/tmp/destdir-stage/usr/local/bin",
      "/tmp/destdir-stage/usr/local/etc",
      "/tmp/destdir-stage/usr/local/lib",
      "/tmp/destdir-stage/usr/local/lib/lcov",
      "/tmp/destdir-stage/usr/local/share",
      "/tmp/destdir-stage/usr/local/share/lcov",
      "/tmp/destdir-stage/usr/local/share/lcov/example",
      "/tmp/destdir-stage/usr/local/share/lcov/example/methods",
      "/tmp/destdir-stage/usr/local/share/lcov/html",
      "/tmp/destdir-stage/usr/local/share/lcov/html/_sources",
      "/tmp/destdir-stage/usr/local/share/lcov/html/_sources/man",
      "/tmp/destdir-stage/usr/local/share/lcov/html/_static",
      "/tmp/destdir-stage/usr/local/share/lcov/html/_static/css",
      "/tmp/destdir-stage/usr/local/share/lcov/html/_static/fonts",
      "/tmp/destdir-stage/usr/local/share/lcov/html/_static/js",
      "/tmp/destdir-stage/usr/local/share/lcov/html/man",
      "/tmp/destdir-stage/usr/local/share/lcov/support-scripts",
      "/tmp/destdir-stage/usr/local/share/lcov/tests",
      "/tmp/destdir-stage/usr/local/share/lcov/tests/bin",
      "/tmp/destdir-stage/usr/local/share/lcov/tests/genhtml",
      "/tmp/destdir-stage/usr/local/share/lcov/tests/genhtml/errs",
      "/tmp/destdir-stage/usr/local/share/lcov/tests/genhtml/exception",
      "/tmp/destdir-stage/usr/local/share/lcov/tests/genhtml/filter",
      "/tmp/destdir-stage/usr/local/share/lcov/tests/genhtml/function",
      "/tmp/destdir-stage/usr/local/share/lcov/tests/genhtml/insensitive",
      "/tmp/destdir-stage/usr/local/share/lcov/tests/genhtml/lambda",
      "/tmp/destdir-stage/usr/local/share/lcov/tests/genhtml/relative",
      "/tmp/destdir-stage/usr/local/share/lcov/tests/genhtml/simple",
      "/tmp/destdir-stage/usr/local/share/lcov/tests/genhtml/synthesize",
      "/tmp/destdir-stage/usr/local/share/lcov/tests/lcov",
      "/tmp/destdir-stage/usr/local/share/lcov/tests/lcov/add",
      "/tmp/destdir-stage/usr/local/share/lcov/tests/lcov/branch",
      "/tmp/destdir-stage/usr/local/share/lcov/tests/lcov/coverage",
      "/tmp/destdir-stage/usr/local/share/lcov/tests/lcov/demangle",
      "/tmp/destdir-stage/usr/local/share/lcov/tests/lcov/errs",
      "/tmp/destdir-stage/usr/local/share/lcov/tests/lcov/exception",
      "/tmp/destdir-stage/usr/local/share/lcov/tests/lcov/extract"
    ],
    "symlink_count": 0
  },
  "identity": {
    "capture_host_tool": "compat/installation/wave2/capture-driver.sh",
    "executable_path": "/usr/bin/make",
    "executable_sha256": "00b2c2071bf57aa52559a91bf8a4ddcd0fcfd4718da2f83100593a45896c1fec",
    "oracle_image_id": "sha256:b02cc645313ff5b0a09adc6d6ddeb5e670e48d64ac376b6b29b34b9d56eb80b7",
    "upstream_commit": "74c8eabbb36d7cf2454d3f0ea37bf1337641cbc5",
    "upstream_release": "v2.5"
  },
  "invocation": {
    "argv": [
      "make",
      "install",
      "DESTDIR=/tmp/destdir-stage",
      "PREFIX=/usr/local"
    ],
    "cleanup": [
      "rm -rf /tmp/destdir-stage /tmp/src"
    ],
    "fixture_setup": [
      "copy pinned upstream source to /tmp/src",
      "pin docs intersphinx inventory",
      "build doc_finished",
      "empty DESTDIR=/tmp/destdir-stage"
    ],
    "timeout_seconds": 600,
    "working_directory": "/tmp/src"
  },
  "observation_sha256": "dbd70295c1b6aa5b149e8a551666fe8c6f20dc2cf10091aba0fafc3715ed2537",
  "oracle_execution_status": "captured",
  "process": {
    "child_processes_observed": [],
    "exit_status": 0,
    "signal": null,
    "timed_out": false
  },
  "product_compatibility_evidence": false,
  "schema_version": 1
}
